{
  "schema_version": "1.0",
  "updated_at": "2026-05-17",
  "currency": "RUB",
  "default_price_rub": 2000,
  "canonical_store_page": {
    "url": "https://moonn.ru/events_tp",
    "tilda_page_id": "66814657",
    "alias": "events_tp",
    "role": "storefront"
  },
  "access_model": {
    "tilda_module": "Tilda Members / Courses",
    "payment_receiver": "Tilda catalog/cart with the existing configured payment provider after visual verification",
    "delivery_rule": "Single lecture purchase grants access to the matching protected Tilda Members/Courses watch page after successful payment.",
    "video_protection_rule": "Do not send raw YouTube links as fulfillment. Embed selected videos only inside protected Tilda Members/Courses pages. YouTube unlisted links are not copy protection.",
    "bundle_delivery_rule": "Bundle purchase grants access to a protected selection flow for five lecture recordings; the final five selected recordings must be written to the order/access registry."
  },
  "lectures": [
    {
      "lecture_id": "timepad-3334362",
      "title": "БЕСПЛАТНЫЕ лекции по ПСИХОЛОГИИ (по пн | 19.00). Психолог Татьяна Мунн",
      "price_rub": 2000,
      "source_page_url": "https://moonn.ru/events_tp",
      "source_tilda_page_id": "66814657",
      "timepad_event_id": "3334362",
      "timepad_source_url": "https://moonn.timepad.ru/event/3334362/",
      "video_source_url": null,
      "tilda_product_sku": "moonn-video-lecture-3334362",
      "tilda_member_group": "moonn-video-lecture-3334362",
      "protected_watch_page_url": null,
      "qr_image_file": "assets/qr/tatyana-munn-paid-lectures-events-tp-qr.png",
      "qr_target_url": "https://moonn.ru/events_tp",
      "status": "needs_video",
      "required_user_input": [
        "matching video URL",
        "confirm whether this Timepad event should be sold as a recording",
        "final protected watch page URL",
        "Tilda catalog product creation and visual checkout test"
      ],
      "notes": "This Timepad entry looks like a recurring/free lecture series rather than one sellable recording. Keep out of paid rollout until owner confirms a specific recording or bundle.",
      "video_match_status": "not_single_recording_series_event",
      "video_match_candidate_count": 0
    },
    {
      "lecture_id": "timepad-3796319",
      "title": "Лекция \"ДУХОВНАЯ Психология\" в Парке Горького - 02 февраля 2026 (пн, 19.00- 21.00)",
      "price_rub": 2000,
      "source_page_url": "https://moonn.ru/events_tp",
      "source_tilda_page_id": "66814657",
      "timepad_event_id": "3796319",
      "timepad_source_url": "https://moonn.timepad.ru/event/3796319/",
      "video_source_url": null,
      "tilda_product_sku": "moonn-video-lecture-3796319",
      "tilda_member_group": "moonn-video-lecture-3796319",
      "protected_watch_page_url": null,
      "qr_image_file": "assets/qr/tatyana-munn-paid-lectures-events-tp-qr.png",
      "qr_target_url": "https://moonn.ru/events_tp",
      "status": "needs_video",
      "required_user_input": [
        "select the correct private YouTube candidate from the sanitized match report",
        "visual verification of current Tilda payment provider before creating paid access",
        "final protected watch page URL",
        "Tilda catalog product creation and visual checkout test"
      ],
      "notes": "Multiple private YouTube Studio candidates matched by title/date. Choose the final recording before creating Tilda paid access. Raw video ids are local-only.",
      "video_match_status": "matched_private_needs_selection",
      "video_match_candidate_count": 2
    },
    {
      "lecture_id": "timepad-3796462",
      "title": "Лекция \"Психология ЛЮБВИ к СЕБЕ\" в Парке Горького - вход свободный 09 февраля 2026 (пн, 19.00- 21.00). Психолог Татьяна Мунн",
      "price_rub": 2000,
      "source_page_url": "https://moonn.ru/events_tp",
      "source_tilda_page_id": "66814657",
      "timepad_event_id": "3796462",
      "timepad_source_url": "https://moonn.timepad.ru/event/3796462/",
      "video_source_url": null,
      "tilda_product_sku": "moonn-video-lecture-3796462",
      "tilda_member_group": "moonn-video-lecture-3796462",
      "protected_watch_page_url": null,
      "qr_image_file": "assets/qr/tatyana-munn-paid-lectures-events-tp-qr.png",
      "qr_target_url": "https://moonn.ru/events_tp",
      "status": "needs_tilda_product",
      "required_user_input": [
        "visual verification of current Tilda payment provider",
        "approval to create one protected Tilda product/watch-page test for this lecture",
        "final protected watch page URL",
        "Tilda catalog product creation and visual checkout test"
      ],
      "notes": "Private YouTube Studio recording matched by title/date. Raw video id is stored only in local output and must not be committed or exposed publicly. Next step: create protected Tilda product/watch page after payment-provider verification.",
      "video_match_status": "matched_private_unique",
      "video_match_candidate_count": 1
    },
    {
      "lecture_id": "timepad-3796469",
      "title": "Лекция \"Психология ГОЛОДА\" в Парке Горького - вход свободный 16 февраля 2026 (пн, 19.00- 21.00). Психолог Татьяна Мунн",
      "price_rub": 2000,
      "source_page_url": "https://moonn.ru/events_tp",
      "source_tilda_page_id": "66814657",
      "timepad_event_id": "3796469",
      "timepad_source_url": "https://moonn.timepad.ru/event/3796469/",
      "video_source_url": null,
      "tilda_product_sku": "moonn-video-lecture-3796469",
      "tilda_member_group": "moonn-video-lecture-3796469",
      "protected_watch_page_url": null,
      "qr_image_file": "assets/qr/tatyana-munn-paid-lectures-events-tp-qr.png",
      "qr_target_url": "https://moonn.ru/events_tp",
      "status": "needs_tilda_product",
      "required_user_input": [
        "visual verification of current Tilda payment provider",
        "approval to create one protected Tilda product/watch-page test for this lecture",
        "final protected watch page URL",
        "Tilda catalog product creation and visual checkout test"
      ],
      "notes": "Private YouTube Studio recording matched by title/date. Raw video id is stored only in local output and must not be committed or exposed publicly. Next step: create protected Tilda product/watch page after payment-provider verification.",
      "video_match_status": "matched_private_unique",
      "video_match_candidate_count": 1
    },
    {
      "lecture_id": "timepad-3796473",
      "title": "Лекция \"Психология МУЖЧИНЫ\" в Парке Горького - вход свободный 23 февраля 2026 (пн, 19.00- 21.00). Психолог Татьяна Мунн",
      "price_rub": 2000,
      "source_page_url": "https://moonn.ru/events_tp",
      "source_tilda_page_id": "66814657",
      "timepad_event_id": "3796473",
      "timepad_source_url": "https://moonn.timepad.ru/event/3796473/",
      "video_source_url": null,
      "tilda_product_sku": "moonn-video-lecture-3796473",
      "tilda_member_group": "moonn-video-lecture-3796473",
      "protected_watch_page_url": null,
      "qr_image_file": "assets/qr/tatyana-munn-paid-lectures-events-tp-qr.png",
      "qr_target_url": "https://moonn.ru/events_tp",
      "status": "needs_video",
      "required_user_input": [
        "select the correct private YouTube candidate from the sanitized match report",
        "visual verification of current Tilda payment provider before creating paid access",
        "final protected watch page URL",
        "Tilda catalog product creation and visual checkout test"
      ],
      "notes": "Multiple private YouTube Studio candidates matched by title/date. Choose the final recording before creating Tilda paid access. Raw video ids are local-only.",
      "video_match_status": "matched_private_needs_selection",
      "video_match_candidate_count": 2
    },
    {
      "lecture_id": "timepad-3808776",
      "title": "Лекция \"Психология Искусственного и Эмоционального ИНТЕЛЛЕКТА\" в Парке Горького - вход свободный 02 марта 2026 (пн, 19.00- 21.00). Психолог Татьяна Мунн",
      "price_rub": 2000,
      "source_page_url": "https://moonn.ru/events_tp",
      "source_tilda_page_id": "66814657",
      "timepad_event_id": "3808776",
      "timepad_source_url": "https://moonn.timepad.ru/event/3808776/",
      "video_source_url": null,
      "tilda_product_sku": "moonn-video-lecture-3808776",
      "tilda_member_group": "moonn-video-lecture-3808776",
      "protected_watch_page_url": null,
      "qr_image_file": "assets/qr/tatyana-munn-paid-lectures-events-tp-qr.png",
      "qr_target_url": "https://moonn.ru/events_tp",
      "status": "needs_video",
      "required_user_input": [
        "select the correct private YouTube candidate from the sanitized match report",
        "visual verification of current Tilda payment provider before creating paid access",
        "final protected watch page URL",
        "Tilda catalog product creation and visual checkout test"
      ],
      "notes": "Multiple private YouTube Studio candidates matched by title/date. Choose the final recording before creating Tilda paid access. Raw video ids are local-only.",
      "video_match_status": "matched_private_needs_selection",
      "video_match_candidate_count": 2
    },
    {
      "lecture_id": "timepad-3808782",
      "title": "Лекция \"Психология ЖЕНЩИНЫ\" в Парке Горького - вход свободный 09 марта 2026 (пн, 19.00- 21.00). Психолог Татьяна Мунн",
      "price_rub": 2000,
      "source_page_url": "https://moonn.ru/events_tp",
      "source_tilda_page_id": "66814657",
      "timepad_event_id": "3808782",
      "timepad_source_url": "https://moonn.timepad.ru/event/3808782/",
      "video_source_url": null,
      "tilda_product_sku": "moonn-video-lecture-3808782",
      "tilda_member_group": "moonn-video-lecture-3808782",
      "protected_watch_page_url": null,
      "qr_image_file": "assets/qr/tatyana-munn-paid-lectures-events-tp-qr.png",